"title","question","correct","wrong1","wrong2","wrong3","explanation"
"Arabic A1+ Vocab 2","ما هو الشيء الذي نلبسه على الرأس؟","قبعة","حذاء","قميص","جوارب","القبعة هي غطاء للرأس"
"Arabic A1+ Vocab 2","ما هو الشيء الذي نلبسه في القدمين؟","حذاء","قبعة","سروال","قميص","الحذاء نلبسه في القدمين للمشي"
"Arabic A1+ Vocab 2","ما اسم الملابس التي نلبسها فوق الجسم؟","قميص","سروال","حذاء","جوارب","القميص نلبسه على الجزء العلوي من الجسم"
"Arabic A1+ Vocab 2","ما اسم الملابس التي نلبسها على الساقين؟","سروال","قميص","قبعة","وشاح","السروال يغطي الساقين"
"Arabic A1+ Vocab 2","ما هو الشيء الذي نلبسه حول الرقبة في الشتاء؟","وشاح","حزام","قبعة","قفازات","الوشاح يُلبس حول الرقبة للدفء"
"Arabic A1+ Vocab 2","ما اسم الملابس التي نلبسها على اليدين في البرد؟","قفازات","جوارب","حذاء","وشاح","القفازات تحمي اليدين من البرد"
"Arabic A1+ Vocab 2","ما هو الشيء الذي نلبسه تحت الحذاء؟","جوارب","قفازات","وشاح","قبعة","الجوارب تُلبس في القدمين تحت الحذاء"
"Arabic A1+ Vocab 2","ما اسم الملابس الطويلة التي تلبسها المرأة؟","فستان","قميص","سروال","معطف","الفستان ملابس نسائية طويلة"
"Arabic A1+ Vocab 2","ما هو الشيء الذي نلبسه فوق الملابس عند الخروج في البرد؟","معطف","قميص","فستان","تنورة","المعطف يحمينا من البرد في الخارج"
"Arabic A1+ Vocab 2","ما اسم الملابس القصيرة التي تلبسها المرأة حول الخصر؟","تنورة","فستان","قميص","وشاح","التنورة قطعة ملابس قصيرة حول الخصر"
"Arabic A1+ Vocab 2","ما هو الشيء الذي نربطه حول الخصر لتثبيت السروال؟","حزام","وشاح","ربطة عنق","قفازات","الحزام يُربط حول الخصر"
"Arabic A1+ Vocab 2","ما اسم الملابس التي نلبسها للنوم؟","بيجاما","معطف","فستان","سروال","البيجاما ملابس خاصة بالنوم"
"Arabic A1+ Vocab 2","ما هو الشيء الذي يلبسه الرجل حول رقبته مع القميص الرسمي؟","ربطة عنق","وشاح","حزام","قبعة","ربطة العنق تُلبس مع الملابس الرسمية"
"Arabic A1+ Vocab 2","ما اسم الحذاء المفتوح الذي نلبسه في الصيف؟","صندل","حذاء رياضي","جزمة","جوارب","الصندل حذاء مفتوح خفيف للصيف"
"Arabic A1+ Vocab 2","ما اسم الحذاء الطويل الذي يغطي الساق؟","جزمة","صندل","حذاء رياضي","خُف","الجزمة حذاء طويل يصل إلى الساق"
"Arabic A1+ Vocab 2","ما اسم القميص بدون أزرار الذي نلبسه عادة في الصيف؟","تي شيرت","معطف","فستان","بيجاما","التي شيرت قميص بسيط بدون أزرار"
"Arabic A1+ Vocab 2","ماذا نقول عندما تسقط المياه من السماء؟","مطر","ثلج","رياح","شمس","المطر هو سقوط الماء من السحب"
"Arabic A1+ Vocab 2","ما اسم الماء المتجمد الأبيض الذي يسقط من السماء في الشتاء؟","ثلج","مطر","برَد","ضباب","الثلج ماء متجمد أبيض يسقط في الشتاء"
"Arabic A1+ Vocab 2","ما الذي نشعر به عندما يتحرك الهواء بقوة؟","رياح","مطر","حرارة","ضباب","الرياح هي حركة الهواء بقوة"
"Arabic A1+ Vocab 2","ما اسم النجم الذي يضيء النهار؟","شمس","قمر","سحابة","نجمة","الشمس هي النجم الذي يعطينا الضوء والحرارة"
"Arabic A1+ Vocab 2","ما اسم الشيء الأبيض الذي نراه في السماء ويحمل المطر؟","سحابة","شمس","قمر","رياح","السحابة تحمل الماء وتنزل المطر"
"Arabic A1+ Vocab 2","ماذا نقول عن الطقس عندما تكون درجة الحرارة مرتفعة جداً؟","حار","بارد","معتدل","ممطر","الطقس الحار يعني درجة حرارة عالية"
"Arabic A1+ Vocab 2","ماذا نقول عن الطقس عندما تكون درجة الحرارة منخفضة جداً؟","بارد","حار","معتدل","مشمس","الطقس البارد يعني درجة حرارة منخفضة"
"Arabic A1+ Vocab 2","ما اسم الضوء المفاجئ في السماء أثناء العاصفة؟","برق","رعد","مطر","رياح","البرق ضوء ساطع يظهر في السماء أثناء العاصفة"
"Arabic A1+ Vocab 2","ما اسم الصوت القوي الذي نسمعه بعد البرق؟","رعد","برق","رياح","مطر","الرعد هو الصوت الذي يأتي بعد البرق"
"Arabic A1+ Vocab 2","ماذا نقول عن الطقس عندما لا يكون حاراً ولا بارداً؟","معتدل","حار","بارد","ممطر","الطقس المعتدل مريح وليس حاراً ولا بارداً"
"Arabic A1+ Vocab 2","ما اسم الطقس عندما لا نستطيع الرؤية بوضوح بسبب الهواء الأبيض؟","ضباب","مطر","ثلج","رياح","الضباب يجعل الرؤية صعبة"
"Arabic A1+ Vocab 2","ماذا نقول عن الطقس عندما تكون السماء صافية والشمس ظاهرة؟","مشمس","ممطر","غائم","عاصف","الطقس المشمس يعني أن الشمس ظاهرة"
"Arabic A1+ Vocab 2","ماذا نقول عن السماء عندما تكون مليئة بالسحب؟","غائم","مشمس","ممطر","معتدل","السماء الغائمة مغطاة بالسحب"
"Arabic A1+ Vocab 2","ما هو قوس الألوان الذي يظهر في السماء بعد المطر؟","قوس قزح","برق","سحابة","شمس","قوس قزح يظهر عندما تشرق الشمس بعد المطر"
"Arabic A1+ Vocab 2","ماذا نقول عن الطقس عندما يكون هناك رياح قوية ومطر غزير؟","عاصفة","ضباب","ثلج","صقيع","العاصفة فيها رياح قوية ومطر شديد"
"Arabic A1+ Vocab 2","ما هو الجليد الصغير الذي يسقط من السماء ويكون صلباً؟","بَرَد","ثلج","مطر","ضباب","البَرَد قطع جليد صغيرة صلبة تسقط من السماء"
"Arabic A1+ Vocab 2","ما اسم الفصل الذي يكون فيه الطقس بارداً جداً؟","شتاء","صيف","ربيع","خريف","الشتاء هو أبرد فصول السنة"
"Arabic A1+ Vocab 2","ما الحيوان الأليف الذي ينبح؟","كلب","قطة","أرنب","طائر","الكلب حيوان أليف معروف بالنباح"
"Arabic A1+ Vocab 2","ما الحيوان الأليف الذي يموء؟","قطة","كلب","سمكة","سلحفاة","القطة حيوان أليف معروف بالمواء"
"Arabic A1+ Vocab 2","ما الحيوان الذي يعطينا الحليب؟","بقرة","دجاجة","حصان","خروف","البقرة تعطينا الحليب"
"Arabic A1+ Vocab 2","ما الحيوان الذي يعطينا البيض؟","دجاجة","بقرة","خروف","ماعز","الدجاجة تبيض البيض"
"Arabic A1+ Vocab 2","ما الحيوان الكبير الذي نركبه؟","حصان","بقرة","خروف","دجاجة","الحصان حيوان كبير نركبه للتنقل"
"Arabic A1+ Vocab 2","ما الحيوان الذي يعيش في الماء ونأكله؟","سمكة","طائر","أرنب","قطة","السمكة تعيش في الماء"
"Arabic A1+ Vocab 2","ما الحيوان الذي يطير في السماء وله ريش؟","طائر","سمكة","أرنب","سلحفاة","الطائر له أجنحة وريش ويطير"
"Arabic A1+ Vocab 2","ما الحيوان الصغير الذي له أذنان طويلتان ويقفز؟","أرنب","قطة","كلب","سلحفاة","الأرنب معروف بأذنيه الطويلتين وقفزه"
"Arabic A1+ Vocab 2","ما الحيوان البطيء الذي يحمل بيته على ظهره؟","سلحفاة","أرنب","سمكة","طائر","السلحفاة بطيئة وتحمل صدفتها على ظهرها"
"Arabic A1+ Vocab 2","ما الحيوان الكبير الذي يعيش في أفريقيا وله خرطوم طويل؟","فيل","أسد","زرافة","قرد","الفيل أكبر حيوان بري وله خرطوم"
"Arabic A1+ Vocab 2","ما الحيوان المفترس الذي يُسمى ملك الغابة؟","أسد","فيل","زرافة","قرد","الأسد يُلقب بملك الغابة"
"Arabic A1+ Vocab 2","ما الحيوان الذي له رقبة طويلة جداً؟","زرافة","فيل","أسد","حصان","الزرافة أطول حيوان بسبب رقبتها الطويلة"
"Arabic A1+ Vocab 2","ما الحيوان الذي يشبه الإنسان ويتسلق الأشجار؟","قرد","أسد","فيل","كلب","القرد قريب من الإنسان ويتسلق الأشجار"
"Arabic A1+ Vocab 2","ما الحيوان الذي نأخذ صوفه لصنع الملابس؟","خروف","بقرة","حصان","دجاجة","الخروف يعطينا الصوف لصنع الملابس"
"Arabic A1+ Vocab 2","ما الحيوان الصغير الذي له ثماني أرجل وينسج شبكة؟","عنكبوت","نملة","نحلة","فراشة","العنكبوت له ثماني أرجل وينسج شبكة"
"Arabic A1+ Vocab 2","ما الحشرة التي تصنع العسل؟","نحلة","نملة","فراشة","عنكبوت","النحلة تصنع العسل من رحيق الأزهار"
"Arabic A1+ Vocab 2","ما الحشرة الجميلة الملونة التي تطير بين الأزهار؟","فراشة","نحلة","نملة","عنكبوت","الفراشة حشرة ملونة وجميلة"
