"title","question","correct","wrong1","wrong2","wrong3","explanation"
"Άποψη: παρόν συνεχές vs στιγμιαίο","Κάθε πρωί ο Νίκος ___ εφημερίδα στο καφενείο.","διαβάζει","διαβάσει","διαβάσεται","διαβαζόταν","Για συνήθεια στο παρόν χρησιμοποιείται ο ενεστώτας (ατελής άποψη): 'διαβάζει'. Το 'διαβάσει' είναι τύπος υποτακτικής, το 'διαβάσεται' δεν υπάρχει ως τύπος, και το 'διαβαζόταν' είναι παρατατικός."
"Άποψη: παρόν επαναλαμβανόμενο","Τα παιδιά ___ μαθήματα κάθε βράδυ.","κάνουν","κάνεται","κάναν","κάνοι","Η επαναλαμβανόμενη πράξη στο παρόν εκφράζεται με ατελή ενεστώτα: 'κάνουν'. Το 'κάνεται' είναι παθητική φωνή, 'κάναν' είναι τύπος αορίστου, και 'κάνοι' δεν υπάρχει ως τύπος."
"Άποψη: αόριστος vs παρατατικός (στιγμιαία πράξη)","Χθες το βράδυ η Μαρία ___ στις δέκα.","κοιμήθηκε","κοιμόταν","κοιμηθεί","κοιμάται","Η ολοκλήρωση μιας πράξης σε συγκεκριμένη στιγμή του παρελθόντος εκφράζεται με αόριστο (τελεία άποψη): 'κοιμήθηκε'. Ο παρατατικός 'κοιμόταν' δηλώνει διάρκεια. Το 'κοιμηθεί' είναι υποτακτική, και 'κοιμάται' είναι ενεστώτας."
"Άποψη: παρατατικός vs αόριστος (διάρκεια)","Όσο έμενε στο εξωτερικό, ___ ισπανικά κάθε μέρα.","διάβαζε","διάβασε","διαβάσει","διαβαζόταν","Η συνεχιζόμενη ή επαναλαμβανόμενη πράξη στο παρελθόν εκφράζεται με παρατατικό (ατελής άποψη): 'διάβαζε'. Ο αόριστος 'διάβασε' δηλώνει ολοκλήρωση. Τα άλλα δύο είναι τύποι υποτακτικής και παθητικός παρατατικός."
"Άποψη: αόριστος ολοκλήρωσης","Επιτέλους, ο Γιώργης ___ το βιβλίο μετά από τρεις μήνες.","τελείωσε","τελείωνε","τελειώσει","τελειώνεται","Η ολοκλήρωση μιας πράξης εκφράζεται με αόριστο: 'τελείωσε'. Ο παρατατικός 'τελείωνε' δηλώνει ανολοκλήρωτη πράξη. Το 'τελειώσει' είναι υποτακτική, και 'τελειώνεται' είναι παθητικός ενεστώτας."
"Άποψη: μέλλοντας ατελής vs τελικός","Τα επόμενα χρόνια θα ___ στη Γερμανία για δουλειά.","εργάζεται","εργαστεί","εργαζόταν","εργαστεί ήταν","Για εκτεταμένη ή επαναλαμβανόμενη πράξη στο μέλλον χρησιμοποιείται ο συνοπτικός μέλλοντας (θα + ενεστώτας αόριστης βουλητικής): 'θα εργάζεται'. Το 'εργαστεί' είναι τελεία άποψη, 'εργαζόταν' παρατατικός, και 'εργαστεί ήταν' δεν είναι έγκυρος τύπος."
"Άποψη: μέλλοντας τελικός (αποτέλεσμα)","Θα ___ την αναφορά μέχρι την Παρασκευή.","ολοκληρώσω","ολοκληρώνω","ολοκληρωθώ","ολοκλήρωσα","Για πράξη που θα ολοκληρωθεί σε συγκεκριμένη χρονική στιγμή χρησιμοποιείται ο στιγμιαίος μέλλοντας (θα + αόριστος υποτακτική): 'ολοκληρώσω'. Το 'ολοκληρώνω' είναι ενεστώτας, 'ολοκληρωθώ' παθητική φωνή, και 'ολοκλήρωσα' αόριστος οριστικής."
"Άποψη: υποτακτική ατελής vs τελεία","Θέλω να ___ ελληνικά κάθε μέρα.","μαθαίνω","μάθω","μαθαίνεται","μαθεί","Η υποτακτική ατελούς άποψης (να + ενεστώτας) εκφράζει συνεχιζόμενη ή επαναλαμβανόμενη πράξη: 'να μαθαίνω'. Το 'μάθω' είναι τελεία άποψη (μία πράξη), 'μαθαίνεται' παθητική φωνή, και 'μαθεί' λείπει το 'να'."
"Άποψη: υποτακτική τελεία (ολοκλήρωση)","Θέλω να ___ αυτό το βιβλίο σήμερα.","τελειώσω","τελειώνω","τελειωθώ","τελείωσα","Η τελεία άποψη (να + αόριστος υποτακτική) εκφράζει ολοκλήρωση της πράξης: 'να τελειώσω'. Ο ενεστώτας 'τελειώνω' δηλώνει συνεχιζόμενη πράξη, 'τελειωθώ' είναι παθητική φωνή, και 'τελείωσα' αόριστος οριστικής που δεν συντάσσεται με 'να'."
"Άποψη: προστακτική ατελής (επαναλαμβανόμενη)","___ τα χέρια σου κάθε φορά που τρως!","Πλένε","Πλύνε","Πλεν","Πλύσε","Η ατελής προστακτική (ενεστώτα) χρησιμοποιείται για επαναλαμβανόμενες ενέργειες ή γενικές οδηγίες: 'Πλένε'. Το 'Πλύνε' είναι τελεία προστακτική (μία φορά), 'Πλεν' δεν υπάρχει ως τύπος, και 'Πλύσε' επίσης δεν υπάρχει."
"Άποψη: προστακτική τελεία (μία φορά)","___ αυτό το γράμμα στο ταχυδρομείο, παρακαλώ.","Στείλε","Στέλνε","Στειλ","Στέλνεσαι","Η τελεία προστακτική χρησιμοποιείται για μία συγκεκριμένη πράξη: 'Στείλε'. Η ατελής 'Στέλνε' δηλώνει επαναλαμβανόμενη πράξη. Το 'Στειλ' και 'Στέλνεσαι' δεν είναι έγκυροι τύποι."
"Άποψη: παρατατικός για διαρκή κατάσταση","Τα παλαιά κτήρια ___ τότε σε άθλια κατάσταση.","βρίσκονταν","βρέθηκαν","βρεθούν","βρίσκονταιν","Η παρατατικός εκφράζει διαρκή κατάσταση στο παρελθόν: 'βρίσκονταν'. Ο αόριστος 'βρέθηκαν' δηλώνει στιγμιαία πράξη, 'βρεθούν' υποτακτική, και 'βρίσκονταιν' δεν υπάρχει ως τύπος."
"Άποψη: αόριστος για αλλαγή κατάστασης","Ξαφνικά, ο ουρανός ___ συννεφιασμένος.","έγινε","γίνεται","γίνονταν","γινόταν","Η ξαφνική αλλαγή κατάστασης εκφράζεται με αόριστο: 'έγινε'. Ο ενεστώτας 'γίνεται' και ο παρατατικός 'γινόταν' δεν εκφράζουν αλλαγή. Το 'γίνονταν' δεν είναι έγκυρος τύπος."
"Άποψη: υποτακτική ατελής (συνήθεια στο παρελθόν)","Πριν αρρωστήσει, συνήθιζε να ___ κάθε Κυριακή.","κολυμπά","κολυμπήσει","κολύμπα","κολυμπηθεί","Για επαναλαμβανόμενη πράξη μετά το 'συνήθιζε να' χρησιμοποιείται η υποτακτική ατελούς άποψης: 'να κολυμπά'. Το 'κολυμπήσει' τελεία άποψη, 'κολύμπα' παρατατικός οριστικής (δεν συντάσσεται με 'να'), και 'κολυμπηθεί' παθητική φωνή."
"Άποψη: μέλλοντας ατελής για μεταβατικό μέλλον","Τα επόμενα χρόνια ___ πολλά στον τομέα της τεχνολογίας.","θα αλλάζουν","θα αλλάξουν","θα άλλαζαν","θα αλλαχτούν","Για εξέλιξη ή διαρκή μεταβολή στο μέλλον χρησιμοποιείται ο ατελής μέλλοντας: 'θα αλλάζουν'. Ο τελικός 'θα αλλάξουν' δηλώνει ολοκληρωμένη αλλαγή, 'θα άλλαζαν' είναι παρατατικός, και 'θα αλλαχτούν' παθητική φωνή."
"Τυπικό ύφος: παθητική φωνή ενεστώτα","Τα έγγραφα ___ από την αρμόδια υπηρεσία.","εξετάζονται","εξετάζουν","εξετάστηκαν","εξετάζεσαι","Στο επίσημο ύφος προτιμάται η παθητική φωνή: 'εξετάζονται'. Το 'εξετάζουν' είναι ενεργητική φωνή, 'εξετάστηκαν' αόριστος, και 'εξετάζεσαι' είναι παθητικό β' ενικό."
"Τυπικό ύφος: παθητική φωνή αορίστου","Η αίτηση ___ σύμφωνα με τους κανονισμούς.","υποβλήθηκε","υπέβαλε","υποβλήθεις","υποβλέθηκε","Στο επίσημο γραπτό λόγο η παθητική φωνή αορίστου είναι: 'υποβλήθηκε'. Το 'υπέβαλε' είναι ενεργητική φωνή, 'υποβλήθεις' δεν υπάρχει ως τύπος, και 'υποβλέθηκε' είναι ορθογραφικό λάθος."
"Τυπικό ύφος: παθητική φωνή μέλλοντα","Οι αποφάσεις ___ στην επόμενη συνεδρίαση.","θα ανακοινωθούν","θα ανακοινώσουν","θα ανακοινωνόταν","θα ανακοινωθεί","Στο επίσημο ύφος η παθητική μελλοντική χρόνου (γ' πληθυντικό): 'θα ανακοινωθούν'. Το 'θα ανακοινώσουν' ενεργητική φωνή, 'θα ανακοινωνόταν' παρατατικός παθητικός, και 'θα ανακοινωθεί' είναι ενικό."
"Τυπικό ύφος: παθητικό μετοχικό κατηγορούμενο","Η σύμβαση ___ από αμφότερες τις πλευρές.","υπεγράφη","υπέγραψε","υπογράφτηκε ήταν","υπογράφω","Στο επίσημο ύφος ο αόριστος παθητικός 'υπεγράφη' είναι η λόγια μορφή. Το 'υπέγραψε' ενεργητική φωνή, 'υπογράφτηκε ήταν' δεν είναι έγκυρος τύπος, και 'υπογράφω' ενεστώτας."
"Τυπικό ύφος: παθητική φωνή υποτακτικής","Είναι απαραίτητο να ___ σχετική τεκμηρίωση.","προσκομιστεί","προσκομίζεται","προσκομίσει","προσκομισθείται","Το επίσημο ύφος προτιμά παθητική υποτακτική: 'να προσκομιστεί'. Το 'προσκομίζεται' ενεστώτας παθητικός (δεν συντάσσεται με 'να' εδώ με υποτακτική σημασία), 'προσκομίσει' ενεργητική υποτακτική, και 'προσκομισθείται' δεν υπάρχει."
"Τυπικό ύφος: παθητική φωνή για 'πήραν απόφαση'","Αποφασίστηκε ___ στην τελευταία συνεδρίαση.","ομόφωνα","ομόφωνους","ομόφωνο","ομόφωνη","Στο επίσημο ύφος χρησιμοποιείται παθητική σύνταξη. Το επίρρημα 'ομόφωνα' είναι η σωστή μορφή. Το 'ομόφωνους' είναι αιτιατική πληθυντικού επιθέτου, 'ομόφωνο' ουδέτερο επίθετο, και 'ομόφωνη' θηλυκό επίθετο."
"Τυπικό ύφος: λόγια έκφραση για χρόνο","___ της υποβολής της αίτησης ορίζεται σε τριάντα ημέρες.","Η προθεσμία","Ο χρόνος","Η ώρα","Το διάστημα ήταν","Στο επίσημο διοικητικό ύφος η λόγια λέξη 'προθεσμία' (deadline) είναι η κατάλληλη επιλογή. Το 'χρόνος' και 'ώρα' είναι λιγότερο εξειδικευμένα, και 'το διάστημα ήταν' δεν αποτελεί έγκυρη σύνταξη εδώ."
"Τυπικό ύφος: παθητική αόριστου σε επίσημη ανακοίνωση","Το νομοσχέδιο ___ από τη Βουλή.","ψηφίστηκε","ψήφισε","ψηφίζεται","ψηφιστεί","Σε επίσημη ανακοίνωση χρησιμοποιείται αόριστος παθητικός: 'ψηφίστηκε'. Το 'ψήφισε' ενεργητική φωνή, 'ψηφίζεται' ενεστώτας παθητικός, και 'ψηφιστεί' υποτακτική."
"Τυπικό ύφος: παθητική φωνή μέλλοντα (απρόσωπο)","___ ειδοποίηση σε όλους τους εγγεγραμμένους.","Θα αποσταλεί","Θα αποστείλει","Θα έχει αποστείλει","Θα αποστελλόταν","Στο επίσημο ύφος η παθητική μελλοντική: 'θα αποσταλεί'. Το 'θα αποστείλει' ενεργητική φωνή, 'θα έχει αποστείλει' παρακείμενος, και 'θα αποστελλόταν' δεν είναι έγκυρος τύπος."
"Μετοχή ενεστώτα: σχηματισμός -οντας","___ στο γραφείο, διάβασε τα έγγραφα.","Μπαίνοντας","Μπαίνωντας","Μπαίνοντος","Μπαίνων","Η μετοχή ενεστώτα σχηματίζεται με κατάληξη -οντας (ή -ώντας): 'Μπαίνοντας'. Το 'Μπαίνωντας' είναι ορθογραφικό λάθος, 'Μπαίνοντος' παλαιότυπη γενική μετοχής που δεν χρησιμοποιείται, και 'Μπαίνων' αρχαία μορφή."
"Μετοχή ενεστώτα: σχηματισμός -ώντας","___ την κατάσταση, ο υπουργός ζήτησε εξηγήσεις.","Αξιολογώντας","Αξιολογόντας","Αξιολογήσοντας","Αξιολογούντας","Τα ρήματα σε -ώ σχηματίζουν μετοχή ενεστώτα σε -ώντας: 'Αξιολογώντας'. Το 'Αξιολογόντας' λανθασμένη κατάληξη, 'Αξιολογήσοντας' δεν υπάρχει, και 'Αξιολογούντας' αρχαία μορφή."
"Μετοχή ενεστώτα: αμετάβλητη μορφή","Η εταιρεία, ___ τους στόχους της, ανακοίνωσε κέρδη.","επιτυγχάνοντας","επιτυγχάνοντα","επιτυγχάνοντος","επιτυγχάνωντας","Η μετοχή ενεστώτα είναι αμετάβλητη (δεν κλίνεται): 'επιτυγχάνοντας'. Τα 'επιτυγχάνοντα' και 'επιτυγχάνοντος' είναι κλιτές μορφές που δεν υπάρχουν στη ΝΕ, και 'επιτυγχάνωντας' ορθογραφικό λάθος."
"Μετοχή ενεστώτα: σημασία ταυτοχρονισμού","___ τη δήλωση, ο υπουργός αναφέρθηκε στις επιπτώσεις.","Αναγινώσκοντας","Αναγινώσκαντας","Αναγνωρίζοντος","Αναγνωριστεί","Η μετοχή ενεστώτα εκφράζει ταυτόχρονη πράξη: 'Αναγινώσκοντας'. Τα 'Αναγινώσκαντας' και 'Αναγνωρίζοντος' δεν είναι έγκυροι τύποι, και 'Αναγνωριστεί' υποτακτική."
"Μετοχή ενεστώτα: αιτιολογική χρήση","___ την αρμοδιότητα, ο διευθυντής έλαβε την απόφαση.","Έχοντας","Έχοντα","Έχοντος","Είχοντας","Η μετοχή 'έχοντας' χρησιμοποιείται εδώ αιτιολογικά (επειδή είχε την αρμοδιότητα). Τα 'Έχοντα' και 'Έχοντος' δεν είναι έγκυροι τύποι στη Νέα Ελληνική, και 'Είχοντας' δεν υπάρχει."
"Μετοχή παρακειμένου παθητική: γένος αρσενικό","Ο ___ φάκελος είχε σφραγιστεί πριν από μέρες.","σφραγισμένος","σφραγισμένη","σφραγισμένο","σφραγισόμενος","Η παθητική μετοχή παρακειμένου για αρσενικό ονοματικό σχηματίζεται σε -μένος: 'σφραγισμένος'. Το 'σφραγισμένη' θηλυκό, 'σφραγισμένο' ουδέτερο, και 'σφραγισόμενος' δεν είναι έγκυρος τύπος."
"Μετοχή παρακειμένου παθητική: γένος θηλυκό","Η ___ έκθεση περιείχε τα αποτελέσματα.","κατατεθειμένη","κατατεθειμένος","κατατεθειμένο","κατατεθέμενη","Η παθητική μετοχή συμφωνεί με το θηλυκό ουσιαστικό 'έκθεση': 'κατατεθειμένη'. Το 'κατατεθειμένος' αρσενικό, 'κατατεθειμένο' ουδέτερο, και 'κατατεθέμενη' δεν είναι έγκυρος τύπος."
"Μετοχή παρακειμένου παθητική: γένος ουδέτερο","Το ___ σχέδιο εγκρίθηκε από την επιτροπή.","εγκεκριμένο","εγκεκριμένος","εγκεκριμένη","εγκεκριμμένο","Η παθητική μετοχή για ουδέτερο: 'εγκεκριμένο'. Το 'εγκεκριμένος' αρσενικό, 'εγκεκριμένη' θηλυκό, και 'εγκεκριμμένο' ορθογραφικό λάθος (διπλό μ)."
"Μετοχή παρακειμένου παθητική: πληθυντικός αρσενικό","Οι ___ φοιτητές έλαβαν το πτυχίο τους.","εγγεγραμμένοι","εγγεγραμμένος","εγγεγραμμένα","εγγεγραμμένη","Η παθητική μετοχή για πληθυντικό αρσενικό: 'εγγεγραμμένοι'. Το 'εγγεγραμμένος' ενικό αρσενικό, 'εγγεγραμμένα' ουδέτερο πληθυντικό, και 'εγγεγραμμένη' θηλυκό ενικό."
"Μετοχή παρακειμένου παθητική: πληθυντικός θηλυκό","Οι ___ αιτήσεις θα εξεταστούν από την επιτροπή.","υποβεβλημένες","υποβεβλημένος","υποβεβλημένα","υποβεβλημμένες","Η παθητική μετοχή για πληθυντικό θηλυκό: 'υποβεβλημένες'. Το 'υποβεβλημένος' αρσενικό ενικό, 'υποβεβλημένα' ουδέτερο πληθυντικό, και 'υποβεβλημμένες' ορθογραφικό λάθος."
"Μετοχή ενεστώτα: ρήμα -ώ (τρίτη συζυγία)","___ την πρόοδο, το συμβούλιο επέλεξε να συνεχίσει.","Παρακολουθώντας","Παρακολουθόντας","Παρακολουθώοντας","Παρακολουθούντας","Τα ρήματα σε -ώ/-άω σχηματίζουν μετοχή ενεστώτα σε -ώντας: 'Παρακολουθώντας'. Το 'Παρακολουθόντας' λανθασμένη κατάληξη, 'Παρακολουθώοντας' δεν υπάρχει, και 'Παρακολουθούντας' αρχαιότροπη μορφή."
"Μετοχή παρακειμένου: σε ρόλο επιθέτου","Τα ___ στοιχεία επιβεβαίωσαν τις υποψίες.","συλλεχθέντα","συλλεχθείς","συλλεχθέντος","συλλεγμένοι","Η παθητική μετοχή για ουδέτερο πληθυντικό ('στοιχεία'): 'συλλεχθέντα' (λόγια) ή 'συλλεγμένα'. Ο τύπος 'συλλεχθείς' αρσενικό ονομαστικό ενικού, 'συλλεχθέντος' γενική ενικού, και 'συλλεγμένοι' αρσενικό πληθυντικό."
"Άποψη: αόριστος σε αφήγηση (sequence of events)","Πρώτα ___ το τηλέφωνο και μετά άνοιξε την πόρτα.","χτύπησε","χτυπούσε","χτυπήσει","χτυπάει","Σε αφήγηση παρελθόντος, διαδοχικές πράξεις εκφράζονται με αόριστο: 'χτύπησε'. Ο παρατατικός 'χτυπούσε' δηλώνει διάρκεια, 'χτυπήσει' υποτακτική, και 'χτυπάει' ενεστώτας."
"Άποψη: παρατατικός για υπόβαθρο (background)","Ενώ ___ η βροχή, ο Κώστας έγραφε στο γραφείο του.","έπεφτε","έπεσε","πέσει","πέφτει","Ο παρατατικός εκφράζει υπόβαθρο (background action) σε σχέση με πρωτεύουσα πράξη: 'έπεφτε'. Ο αόριστος 'έπεσε' ολοκλήρωση, 'πέσει' υποτακτική, και 'πέφτει' ενεστώτας."
"Άποψη: υποτακτική τελεία για εντολή (directive)","Ο γιατρός ζήτησε να ___ αμέσως το φάρμακο.","ληφθεί","λαμβάνεται","λαμβάνεται εδώ","ληφθείτε","Η τελεία υποτακτική παθητική 'ληφθεί' εκφράζει συγκεκριμένη πράξη που πρέπει να ολοκληρωθεί. Το 'λαμβάνεται' ενεστώτας (ατελής), 'λαμβάνεται εδώ' δεν είναι έγκυρη σύνταξη, και 'ληφθείτε' πληθυντικό."
"Τυπικό ύφος: λόγια παθητική φωνή αορίστου","Το ζήτημα ___ κατά τη διάρκεια της συνεδρίασης.","συζητήθηκε","συζητήθηκαν","συζητείται","συζήτησε","Ο αόριστος παθητικός για το ζήτημα (ενικό): 'συζητήθηκε'. Το 'συζητήθηκαν' πληθυντικό, 'συζητείται' ενεστώτας παθητικός, και 'συζήτησε' ενεργητικός."
"Τυπικό ύφος: παθητική για απρόσωπη αναφορά","___ ότι η πρόταση δεν ικανοποιεί τις απαιτήσεις.","Επισημαίνεται","Επισημαίνει","Επισήμαναν","Επισημάνθηκαν","Στο επίσημο ύφος η απρόσωπη παθητική 'επισημαίνεται' χρησιμοποιείται για αντικειμενική παρουσίαση. Το 'επισημαίνει' ενεργητική (χρειάζεται υποκείμενο), 'επισήμαναν' αόριστος ενεργητικός, και 'επισημάνθηκαν' πληθυντικό παθητικό."
"Τυπικό ύφος: λόγια παθητική φωνή μέλλοντα","Τα αποτελέσματα ___ την επόμενη εβδομάδα.","θα δημοσιευθούν","θα δημοσιεύσουν","θα δημοσιεύονται","θα δημοσιευθεί","Η παθητική μελλοντική πληθυντικού: 'θα δημοσιευθούν'. Το 'θα δημοσιεύσουν' ενεργητική φωνή, 'θα δημοσιεύονται' ατελής (ενεστώτας), και 'θα δημοσιευθεί' ενικό."
"Μετοχή ενεστώτα: χρόνος (ταυτοχρονισμός)","___ για έξοδο, ο υπάλληλος υπέγραψε τα τελευταία έγγραφα.","Προετοιμαζόμενος","Προετοιμαζόμενους","Προετοιμαζόμενη","Προετοιμαζομένου","Η κλιτή (εδώ: αρσενικό ενικό) παθητική μετοχή ενεστώτα: 'Προετοιμαζόμενος'. Το 'Προετοιμαζόμενους' αιτιατική πληθυντικού, 'Προετοιμαζόμενη' θηλυκό, και 'Προετοιμαζομένου' γενική αρχαιότροπη."
