"title","question","correct","wrong1","wrong2","wrong3","explanation"
"Μετοχή παρακειμένου παθητική: γενική (κτητική)","Η αξία του ___ αυτοκινήτου ήταν υψηλή.","μεταχειρισμένου","μεταχειρισμένο","μεταχειρισμένος","μεταχειρισμένη","Η παθητική μετοχή στη γενική ενικού αρσενικού: 'μεταχειρισμένου'. Το 'μεταχειρισμένο' ουδέτερο ονομαστική/αιτιατική, 'μεταχειρισμένος' αρσενικό ονομαστική, και 'μεταχειρισμένη' θηλυκό."
"Μετοχή παρακειμένου παθητική: σε αιτιατική","Βρήκαν τον ___ λογαριασμό πίσω από τα βιβλία.","χαμένο","χαμένης","χαμένοι","χαμένους","Ο 'λογαριασμός' είναι αρσενικό ενικό αιτιατικής: 'χαμένο' (άρθρο 'τον' + αιτιατική). Το 'χαμένης' γενική θηλυκού, 'χαμένοι' αρσενικό πληθυντικό ονομαστική, και 'χαμένους' αρσενικό πληθυντικό αιτιατική."
"Άποψη: υποτακτική ατελής σε στόχο","Προσπαθεί να ___ καλύτερος κάθε μέρα.","γίνεται","γίνει","γέγονε","γενόταν","Η ατελής υποτακτική 'να γίνεται' εκφράζει συνεχή προσπάθεια (κάθε μέρα). Η τελεία 'να γίνει' εκφράζει ολοκλήρωση. Εδώ η ατελής είναι σωστή λόγω 'κάθε μέρα'. Το 'γέγονε' αρχαία μορφή, και 'γενόταν' παθητικός παρατατικός."
"Άποψη: μέλλοντας ατελής για πρόγραμμα","Αύριο θα ___ για την Αθήνα νωρίς το πρωί.","φεύγουμε","φύγουμε","έφυγα","φεύγεις","Ο ατελής μέλλοντας (θα + ενεστώτας) εκφράζει προγραμματισμένη πράξη: 'θα φεύγουμε'. Η τελεία άποψη 'φύγουμε' δηλώνει ολοκλήρωση εξόδου, 'έφυγα' αόριστος α' ενικού, και 'φεύγεις' β' ενικό ενεστώτα."
"Τυπικό ύφος: λόγια ρήματα αντί καθημερινών","Το συμβούλιο ___ ότι το σχέδιο ήταν ελλιπές.","διαπίστωσε","βρήκε","είδε","θεωρούσε","Στο επίσημο ύφος χρησιμοποιείται το λόγιο ρήμα 'διαπίστωσε' αντί του καθημερινού 'βρήκε'. Τα 'βρήκε', 'είδε', και 'θεωρούσε' είναι γραμματικά σωστά αλλά ανεπίσημα για επίσημο έγγραφο. Σημείωση: εδώ δοκιμάζεται λεξιλογική εκλογή επίσημου ύφους."
"Μετοχή ενεστώτα: σύνταξη με υποκείμενο","Η εταιρεία, ___ τις ζημίες, κατέθεσε αγωγή.","αποτιμώντας","αποτιμόντας","αποτιμώντα","αποτιμήσαντας","Τα ρήματα σε -ώ σχηματίζουν μετοχή σε -ώντας: 'αποτιμώντας'. Το 'αποτιμόντας' λανθασμένη κατάληξη, 'αποτιμώντα' κλιτή μορφή που δεν υπάρχει, και 'αποτιμήσαντας' αρχαιότροπη μορφή αορίστου."
"Μετοχή παρακειμένου: κλίση σε γενική θηλυκού","Η τιμή της ___ γης ήταν υψηλή.","αγορασμένης","αγορασμένο","αγορασμένης είναι","αγορασμένου","Η παθητική μετοχή σε γενική ενικού θηλυκού: 'αγορασμένης'. Το 'αγορασμένο' ουδέτερο ονομαστική, 'αγορασμένης είναι' δεν είναι έγκυρη φράση, και 'αγορασμένου' γενική αρσενικού/ουδετέρου."
