"title","question","correct","wrong1","wrong2","wrong3","explanation"
"precisione: conciso","Quale aggettivo descrive un discorso che dice molto in poche parole, con alta densità di contenuto?","conciso","prolisso","esauriente","eloquente","'Conciso' descrive un testo denso e sintetico. 'Prolisso' è il contrario (troppo lungo). 'Esauriente' significa completo ma non implica brevità. 'Eloquente' riguarda l'efficacia espressiva, non la brevità."
"sfumatura: sostenere","Quale verbo significa 'difendere una posizione portando argomenti a supporto'?","sostenere","affermare","dichiarare","ribadire","'Sostenere' significa difendere una tesi con argomenti. 'Affermare' è più neutro (dire con certezza). 'Dichiarare' è formale e unidirezionale. 'Ribadire' significa ripetere con forza, non argomentare."
"registro: compilare","Quale collocazione è corretta in italiano formale?","compilare un modulo","redigere un modulo","completare un modulo","riempire un modulo","'Compilare un modulo' è la collocazione formale standard. 'Redigere' si usa per documenti/testi, non moduli. 'Completare' e 'riempire' sono più informali e meno precisi."
"retorica: climax","Quale figura retorica consiste nell'accumulo di termini in ordine di intensità crescente?","climax","anafora","iperbole","gradazione","La climax (o gradazione ascendente) accumula termini di intensità crescente. L'anafora è la ripetizione iniziale. L'iperbole è un'esagerazione. 'Gradazione' è un sinonimo parziale ma meno specifico."
"connotazione: snello","Quale aggettivo ha connotazione positiva, suggerendo un fisico armonioso e sano?","snello","magro","esile","slanciato","'Snello' ha connotazione positiva (armonioso). 'Magro' è più neutro e può essere negativo. 'Esile' suggerisce fragilità. 'Slanciato' enfatizza l'altezza più che la forma armoniosa."
"precisione: adeguato","Completa: 'Le risorse non erano ___ alle esigenze del progetto.'","adeguate","adeguati","sufficienti","idonee","Con 'risorse' (femminile plurale) serve l'accordo 'adeguate'. 'Adeguati' è maschile plurale (errore di concordanza). 'Sufficienti' e 'idonee' sono simili ma non reggono 'a' nello stesso modo."
"stile: ridondanza","Quale espressione è ridondante (contiene un pleonasmo)?","salire su in alto","raggiungere la vetta","arrivare in cima","scalare la montagna","'Salire su in alto' è ridondante: 'salire' implica già movimento verso l'alto. Le altre espressioni sono corrette."
"retorica: eufemismo","Quale figura retorica sostituisce un'espressione cruda con una più attenuata o delicata?","eufemismo","litote","perifrasi","understatement","L'eufemismo attenua un'espressione sgradevole. La litote afferma negando il contrario. La perifrasi usa un giro di parole. L'understatement minimizza."
"sfumatura: tenace","Quale aggettivo ha connotazione positiva ('ammirevole perseveranza')?","tenace","ostinato","caparbio","testardo","'Tenace' è positivo (ammirevole perseveranza). 'Ostinato' ha sfumatura negativa (non si arrende irragionevolmente). 'Caparbio' e 'testardo' sono negativi (cocciutaggine)."
"precisione: pertinente","Completa: 'Questa osservazione non è ___ al tema della discussione.'","pertinente","pertinenta","pertinento","pertinenti","'Pertinente' è l'aggettivo corretto (invariabile nel genere: pertinente/pertinenti). 'Pertinenta' e 'pertinento' non esistono. 'Pertinenti' è plurale, ma 'osservazione' è singolare."
"registro: aulico","Nel registro aulico, come si completa: 'Si ___ i presenti a prendere posto'?","pregano","invitano","esortano","chiedono","'Si pregano i presenti' è la costruzione corretta nel registro aulico (passivante). 'Si invitano' è meno formale. 'Si esortano' è troppo enfatico. 'Si chiedono' non è la collocazione corretta."
"stile: litote","La figura retorica che afferma qualcosa negando il contrario si chiama:","litote","eufemismo","antifrasi","ironia","La litote (es. 'non è il più intelligente' = 'è piuttosto stupido'). L'eufemismo attenua. L'antifrasi dice il contrario di ciò che si intende. L'ironia è più ampia e non si basa sulla doppia negazione."
"connotazione: furbo","Quale aggettivo italiano connota specificamente chi aggira le regole per vantaggio personale?","furbo","astuto","scaltro","sveglio","'Furbo' ha questa connotazione specifica in italiano ('fare il furbo'). 'Astuto' è più neutro (intelligenza strategica). 'Scaltro' enfatizza l'esperienza. 'Sveglio' è positivo (prontezza mentale)."
"precisione: presumere","Quale verbo significa 'ritenere arrogantemente di possedere qualcosa'?","presumere","supporre","dedurre","ipotizzare","'Presumere' ha questa sfumatura di arroganza. 'Supporre' è neutro (ipotizzare senza certezza). 'Dedurre' implica un ragionamento logico. 'Ipotizzare' è formale e neutro."
"retorica: antitesi","La figura retorica che accosta due concetti opposti in strutture parallele si chiama:","antitesi","ossimoro","paradosso","contrasto","L'antitesi (es. 'Era il migliore dei tempi, era il peggiore dei tempi'). L'ossimoro unisce opposti in un'unica espressione. Il paradosso è un'affermazione controintuitiva. 'Contrasto' è generico, non un termine retorico specifico."
"stile: registro","In un saggio accademico, quale verbo è considerato troppo generico per 'un'analisi'?","fare","effettuare","condurre","svolgere","Nel registro accademico 'effettuare', 'condurre' e 'svolgere un'analisi' sono accettabili; 'fare un'analisi' è considerato troppo generico."
"sfumatura: esigere","Quale verbo italiano implica autorità assoluta che non ammette discussione?","esigere","richiedere","pretendere","reclamare","'Esigere' implica autorità assoluta. 'Richiedere' è neutro (domandare formalmente). 'Pretendere' ha sfumatura negativa ma meno autoritaria. 'Reclamare' implica un diritto da far valere."
"precisione: laconico","Quale aggettivo descrive una risposta estremamente breve, quasi fredda o distaccata?","laconico","conciso","succinto","stringato","'Laconico' ha origine dagli Spartani (Laconia) e implica brevità fredda e distaccata. 'Conciso' è positivo (efficiente). 'Succinto' indica brevità senza sfumatura fredda. 'Stringato' significa essenziale ma non implica distacco."
"registro: burocratico","Quale verbo completa la formula burocratica 'Con la presente si ___ che...'?","comunica","notifica","informa","dichiara","'Con la presente si comunica che' è la formula burocratica standard. 'Si notifica' è più giuridico. 'Si informa' è meno formale. 'Si dichiara' ha valore giuridico diverso (attestazione)."
"connotazione: popolare","Quale aggettivo ha connotazione neutra o positiva ('legato al popolo, tradizionale')?","popolare","popolano","plebeo","volgare","'Popolare' (festa popolare) è neutro/positivo. 'Popolano' ha sfumatura storica (classi basse medievali). 'Plebeo' è dispregiativo. 'Volgare' significa sia 'del popolo' che 'grossolano' ed è spesso negativo."
"retorica: anafora","La figura retorica che consiste nella ripetizione di parole all'inizio di frasi successive si chiama:","anafora","epifora","anadiplosi","epistrofe","L'anafora (es. 'Ho un sogno... Ho un sogno...'). L'epifora (o epistrofe) è la ripetizione alla fine. L'anadiplosi riprende l'ultima parola all'inizio della frase successiva."
"sfumatura: veemente","Quale aggettivo descrive un discorso appassionato e forte, nel campo della retorica (non della violenza)?","veemente","impetuoso","focoso","acceso","'Veemente' descrive passione retorica intensa. 'Impetuoso' suggerisce mancanza di controllo. 'Focoso' ha connotazione più emotiva/temperamentale. 'Acceso' è meno specifico (un dibattito acceso è generico)."
"precisione: ambiguo","Completa: 'La formulazione della legge è ___ e si presta a più interpretazioni.'","ambigua","vaga","oscura","equivoca","'Ambigua' è l'aggettivo specifico per qualcosa che ammette più interpretazioni. 'Vaga' indica imprecisione generica. 'Oscura' suggerisce incomprensibilità. 'Equivoca' è vicina ma ha sfumatura più negativa (ingannevole)."
"stile: collocazione","Un argomento che non si può contestare o smentire è un argomento:","inconfutabile","confutabile","discutibile","opinabile","'Inconfutabile' significa che non si può smentire. 'Confutabile' è il contrario (= che si può smentire). 'Discutibile' e 'opinabile' indicano qualcosa di dubbio o soggetto a opinioni — l'opposto di ciò che la definizione descrive."
"connotazione: oculato","Quale aggettivo ha connotazione positiva ('che gestisce le risorse con saggezza')?","oculato","parsimonioso","prudente","accorto","'Oculato' è specificamente positivo nella gestione delle risorse (amministratore oculato). 'Parsimonioso' enfatizza il risparmio più che la saggezza. 'Prudente' è più generico. 'Accorto' indica scaltrezza più che saggezza gestionale."
"retorica: ossimoro","La figura retorica che unisce due termini contraddittori in un'unica espressione si chiama:","ossimoro","antitesi","paradosso","contraddizione","L'ossimoro (es. 'silenzio assordante'). L'antitesi accosta opposti in strutture parallele, non nella stessa espressione. Il paradosso è un'affermazione apparentemente assurda. 'Contraddizione' è generico, non un termine retorico."
"precisione: attuare","Quale verbo italiano significa specificamente 'mettere in pratica una norma'?","attuare","applicare","implementare","eseguire","'Attuare' è il verbo specifico (attuare una legge/riforma). 'Applicare' è simile ma più generico. 'Implementare' è un anglicismo tecnico. 'Eseguire' implica un ordine più che una norma."
"sfumatura: insinuare","Quale verbo implica un'accusa velata, fatta in modo subdolo e indiretto?","insinuare","alludere","sottintendere","suggerire","'Insinuare' implica un'accusa subdola e malevola. 'Alludere' è più neutro (riferimento indiretto). 'Sottintendere' indica qualcosa di implicito senza malizia. 'Suggerire' è neutro/positivo."
"stile: registro giornalistico","Quale aggettivo è tipico del registro giornalistico italiano per indicare un fatto clamoroso?","eclatante","clamoroso","sensazionale","strepitoso","'Eclatante' (dal francese) è il termine tipico del giornalismo italiano. 'Clamoroso' è più comune nel linguaggio quotidiano. 'Sensazionale' è più enfatico e meno formale. 'Strepitoso' è informale."
"precisione: eludere","Quale verbo significa 'aggirare con astuzia, parlando d'altro'?","eludere","evitare","elidere","schivare","'Eludere' (una domanda, un obbligo) implica astuzia nell'aggirare. 'Evitare' è più diretto e senza astuzia. 'Elidere' significa cancellare/eliminare. 'Schivare' è fisico o molto informale."
"connotazione: sfacciato","Quale aggettivo italiano colloquiale descrive chi 'non si vergogna di nulla' e 'fa il furbo' sfidando le regole sociali?","sfacciato","timido","riservato","discreto","'Sfacciato' descrive chi non ha vergogna e sfida le regole sociali. 'Timido', 'riservato' e 'discreto' indicano il contrario: chi è ritroso, pudico o non invadente."
"retorica: domanda retorica","Una domanda che non richiede risposta perché la risposta è implicita si dice:","retorica","provocatoria","suggestiva","captativa","'Domanda retorica' è il termine corretto. 'Provocatoria' mira a suscitare reazione. 'Suggestiva' implica un'influenza sulla risposta. 'Captativa' (giuridico) cerca di ottenere favore."
"stile: perifrasi","La figura retorica che sostituisce un nome con una descrizione più lunga si chiama:","perifrasi","metonimia","sineddoche","antonomasia","La perifrasi (es. 'il bel paese' per l'Italia). La metonimia sostituisce con un termine collegato. La sineddoche usa la parte per il tutto. L'antonomasia usa un nome proprio come comune o viceversa."
"sfumatura: ignorare","Quale verbo implica un rifiuto consapevole e volontario di prestare attenzione?","ignorare","trascurare","tralasciare","sottovalutare","'Ignorare' implica una scelta consapevole di non considerare. 'Trascurare' indica disattenzione o negligenza. 'Tralasciare' significa omettere deliberatamente. 'Sottovalutare' significa dare meno importanza del dovuto."
"precisione: intrinseco","Quale aggettivo significa 'proprio della natura stessa di qualcosa'?","intrinseco","innato","connaturato","insito","'Intrinseco' si riferisce alla natura essenziale di qualcosa (valore intrinseco). 'Innato' si usa per qualità dalla nascita. 'Connaturato' indica qualcosa di profondamente radicato. 'Insito' significa contenuto dentro, ma è meno specifico."
"registro: accademico","Quale formula è la standard del registro accademico formale?","Come evidenziato da numerosi studi","Come evidente di numerosi studi","Come evidenziando numerosi studi","Come evidenziato di numerosi studi","'Come evidenziato da' è la formula corretta con la preposizione 'da' (complemento d'agente). Le varianti proposte hanno preposizioni o forme verbali errate."
"connotazione: severo","Quale aggettivo descrive rigore nelle regole ma con giustizia?","severo","rigido","inflessibile","austero","'Severo' implica rigore giusto (professore severo ma giusto). 'Rigido' è più negativo (senza flessibilità). 'Inflessibile' è ancora più estremo. 'Austero' enfatizza la sobrietà più che la giustizia."
"retorica: iperbole","La figura retorica dell'esagerazione volutamente eccessiva si chiama:","iperbole","iperbola","enfasi","amplificazione","'Iperbole' è il termine italiano per questa figura. 'Iperbola' è il termine matematico (conica). 'Enfasi' è un rafforzamento generico. 'Amplificazione' è un procedimento retorico più ampio."
"stile: incisivo","Quale aggettivo descrive un discorso efficace e diretto che 'lascia il segno'?","incisivo","efficace","penetrante","tagliente","'Incisivo' descrive un discorso che lascia il segno (metafora dell'incidere). 'Efficace' è più generico. 'Penetrante' si usa più per sguardi o analisi. 'Tagliente' implica crudezza o aggressività."
"sfumatura: redarguire","Quale verbo indica un rimprovero formale e autorevole?","redarguire","rimproverare","ammonire","riprendere","'Redarguire' è il verbo formale e autorevole per un rimprovero. 'Rimproverare' è più comune e meno formale. 'Ammonire' implica un avvertimento. 'Riprendere' è informale."
"precisione: palese","Quale aggettivo regge naturalmente la preposizione 'a' (es. 'era ___ a tutti')?","palese","evidente","chiaro","manifesto","'Palese a tutti' è la collocazione corretta. 'Evidente' regge 'a' ma è meno specifico. 'Chiaro a tutti' è più informale. 'Manifesto' regge 'a' ma è più formale e meno comune."
"connotazione: sobrio","Quale aggettivo ha connotazione positiva ('elegante senza eccessi')?","sobrio","austero","spartano","essenziale","'Sobrio' è positivo (arredamento sobrio ma elegante). 'Austero' ha sfumatura più severa. 'Spartano' implica rinuncia estrema. 'Essenziale' è neutro e più generico."
"retorica: metonimia","La figura retorica che sostituisce un termine con un altro ad esso collegato (es. contenitore per contenuto) si chiama:","metonimia","sineddoche","antonomasia","perifrasi","La metonimia (es. 'bere un bicchiere'). La sineddoche usa la parte per il tutto. L'antonomasia sostituisce un nome proprio con un appellativo. La perifrasi usa un giro di parole."
"stile: collocazione formale","Quale collocazione completa la formula burocratica 'In ___ alla Sua richiesta del...'?","merito","riferimento","risposta","seguito","'In merito a' è la collocazione burocratica standard. 'In riferimento a' esiste ma è meno preciso qui. 'In risposta a' è più informale. 'In seguito a' indica una conseguenza temporale, non un argomento."
"sfumatura: alludere","Quale verbo implica un riferimento indiretto e velato, senza nominare esplicitamente?","alludere","accennare","menzionare","citare","'Alludere' significa riferirsi senza nominare, in modo velato. 'Accennare' è simile ma meno velato. 'Menzionare' è diretto e esplicito. 'Citare' è formale e diretto."
"precisione: perentorio","Quale aggettivo, in ambito giuridico, indica un termine o ordine che non ammette dilazione?","perentorio","tassativo","categorico","imperativo","'Perentorio' è il termine giuridico specifico (termine perentorio). 'Tassativo' indica qualcosa di rigoroso ma è meno tecnico. 'Categorico' è più generico (rifiuto categorico). 'Imperativo' indica urgenza/obbligo morale."
"registro: letterario","Nella frase 'il vento sussurrava tra gli alberi', quale figura retorica è usata?","personificazione","metafora","similitudine","sinestesia","La personificazione attribuisce azioni umane a cose o elementi naturali. La metafora sostituisce un termine con un altro. La similitudine usa 'come'. La sinestesia mescola percezioni sensoriali diverse."
"connotazione: parsimonioso","Quale aggettivo ha connotazione positiva ('che usa le risorse con saggezza, senza sprechi')?","parsimonioso","avaro","tirchio","frugale","'Parsimonioso' è positivo (gestione saggia). 'Avaro' e 'tirchio' sono negativi (eccessiva avarizia). 'Frugale' è simile ma enfatizza la semplicità più che la saggezza nella gestione."
"stile: coerenza","Quale aggettivo descrive un testo in cui le idee non si contraddicono e seguono un filo logico?","coerente","logico","lineare","consequenziale","'Coerente' è il termine specifico per assenza di contraddizioni in un testo. 'Logico' è più generico. 'Lineare' enfatizza la sequenzialità. 'Consequenziale' indica rapporti di causa-effetto."
"sfumatura: deprecabile","Quale aggettivo deriva dal verbo 'deprecare' e significa 'meritevole di forte disapprovazione'?","deprecabile","deplorabile","deprecato","deprecante","'Deprecabile' è l'aggettivo derivato da 'deprecare' con il suffisso '-abile'. 'Deplorabile' deriva da 'deplorare', non 'deprecare'. 'Deprecato' è il participio passato, non un aggettivo di merito. 'Deprecante' non è una forma standard."
